{
    "author": {
        "name": "Stella Smith",
        "url": "https://github.com/StellaSmith/"
    },
    "license": "GPL-2.0",
    "url": "https://github.com/StellaSmith/little_game/",
    "comment": "A Cube",
    "vertices": [
        {
            "position": [
                -0.5,
                0.5,
                -0.5
            ],
            "uv": [
                0.0,
                0.0
            ]
        },
        {
            "position": [
                -0.5,
                0.5,
                0.5
            ],
            "uv": [
                0.0,
                1.0
            ]
        },
        {
            "position": [
                0.5,
                0.5,
                0.5
            ],
            "uv": [
                1.0,
                1.0
            ]
        },
        {
            "position": [
                0.5,
                0.5,
                -0.5
            ],
            "uv": [
                1.0,
                0.0
            ]
        },
        {
            "position": [
                0.5,
                0.5,
                -0.5
            ],
            "uv": [
                0.0,
                0.0
            ]
        },
        {
            "position": [
                0.5,
                -0.5,
                -0.5
            ],
            "uv": [
                0.0,
                1.0
            ]
        },
        {
            "position": [
                -0.5,
                -0.5,
                -0.5
            ],
            "uv": [
                1.0,
                1.0
            ]
        },
        {
            "position": [
                -0.5,
                0.5,
                -0.5
            ],
            "uv": [
                1.0,
                0.0
            ]
        },
        {
            "position": [
                -0.5,
                0.5,
                -0.5
            ],
            "uv": [
                0.0,
                0.0
            ]
        },
        {
            "position": [
                -0.5,
                -0.5,
                -0.5
            ],
            "uv": [
                0.0,
                1.0
            ]
        },
        {
            "position": [
                -0.5,
                -0.5,
                0.5
            ],
            "uv": [
                1.0,
                1.0
            ]
        },
        {
            "position": [
                -0.5,
                0.5,
                0.5
            ],
            "uv": [
                1.0,
                0.0
            ]
        },
        {
            "position": [
                0.5,
                0.5,
                0.5
            ],
            "uv": [
                0.0,
                0.0
            ]
        },
        {
            "position": [
                0.5,
                -0.5,
                0.5
            ],
            "uv": [
                0.0,
                1.0
            ]
        },
        {
            "position": [
                -0.5,
                -0.5,
                0.5
            ],
            "uv": [
                1.0,
                1.0
            ]
        },
        {
            "position": [
                -0.5,
                0.5,
                0.5
            ],
            "uv": [
                1.0,
                0.0
            ]
        },
        {
            "position": [
                0.5,
                0.5,
                -0.5
            ],
            "uv": [
                0.0,
                0.0
            ]
        },
        {
            "position": [
                0.5,
                -0.5,
                -0.5
            ],
            "uv": [
                0.0,
                1.0
            ]
        },
        {
            "position": [
                0.5,
                -0.5,
                0.5
            ],
            "uv": [
                1.0,
                1.0
            ]
        },
        {
            "position": [
                0.5,
                0.5,
                0.5
            ],
            "uv": [
                1.0,
                0.0
            ]
        },
        {
            "position": [
                -0.5,
                -0.5,
                -0.5
            ],
            "uv": [
                0.0,
                0.0
            ]
        },
        {
            "position": [
                -0.5,
                -0.5,
                0.5
            ],
            "uv": [
                0.0,
                1.0
            ]
        },
        {
            "position": [
                0.5,
                -0.5,
                0.5
            ],
            "uv": [
                1.0,
                1.0
            ]
        },
        {
            "position": [
                0.5,
                -0.5,
                -0.5
            ],
            "uv": [
                1.0,
                0.0
            ]
        }
    ],
    "faces": [
        {
            "indices": [
                0,
                1,
                2,
                3
            ],
            "sides": [
                "top"
            ],
            "texture": 0,
            "solid": true
        },
        {
            "indices": [
                4,
                5,
                6,
                7
            ],
            "sides": [
                "north"
            ],
            "texture": 0,
            "solid": true
        },
        {
            "indices": [
                8,
                9,
                10,
                11
            ],
            "sides": [
                "west"
            ],
            "texture": 0,
            "solid": true
        },
        {
            "indices": [
                12,
                13,
                14,
                15
            ],
            "sides": [
                "south"
            ],
            "texture": 0,
            "solid": true
        },
        {
            "indices": [
                16,
                17,
                18,
                19
            ],
            "sides": [
                "east"
            ],
            "texture": 0,
            "solid": true
        },
        {
            "indices": [
                20,
                21,
                22,
                23
            ],
            "sides": [
                "bottom"
            ],
            "texture": 0,
            "solid": true
        }
    ]
}